{
  "card_type": "dataset",
  "id": "ds:gh-tier2-v0",
  "name": "public GitHub issue->fixing-PR Tier-2 scale dataset (~150 repos)",
  "version": "v0",
  "created_at": "2026-06-22T11:25:17Z",
  "sources": [
    "src:gh-t2:Delgan/loguru",
    "src:gh-t2:HypothesisWorks/hypothesis",
    "src:gh-t2:MagicStack/asyncpg",
    "src:gh-t2:Textualize/rich",
    "src:gh-t2:Textualize/textual",
    "src:gh-t2:agronholm/anyio",
    "src:gh-t2:aio-libs/aiohttp",
    "src:gh-t2:arrow-py/arrow",
    "src:gh-t2:astral-sh/ruff",
    "src:gh-t2:boto/boto3",
    "src:gh-t2:boto/botocore",
    "src:gh-t2:celery/kombu",
    "src:gh-t2:certifi/python-certifi",
    "src:gh-t2:chalk/chalk",
    "src:gh-t2:clap-rs/clap",
    "src:gh-t2:click-contrib/click-completion",
    "src:gh-t2:coleifer/peewee",
    "src:gh-t2:dask/dask",
    "src:gh-t2:encode/databases",
    "src:gh-t2:encode/httpcore",
    "src:gh-t2:encode/httpx",
    "src:gh-t2:encode/starlette",
    "src:gh-t2:encode/uvicorn",
    "src:gh-t2:ewels/rich-click",
    "src:gh-t2:expressjs/express",
    "src:gh-t2:fabric/fabric",
    "src:gh-t2:fastapi/fastapi",
    "src:gh-t2:fastapi/typer",
    "src:gh-t2:gin-gonic/gin",
    "src:gh-t2:jd/tenacity",
    "src:gh-t2:joblib/joblib",
    "src:gh-t2:lxml/lxml",
    "src:gh-t2:marshmallow-code/marshmallow",
    "src:gh-t2:matplotlib/matplotlib",
    "src:gh-t2:more-itertools/more-itertools",
    "src:gh-t2:mwaskom/seaborn",
    "src:gh-t2:networkx/networkx",
    "src:gh-t2:numpy/numpy",
    "src:gh-t2:pallets/click",
    "src:gh-t2:pallets/flask",
    "src:gh-t2:pallets/jinja",
    "src:gh-t2:pallets/markupsafe",
    "src:gh-t2:pallets/werkzeug",
    "src:gh-t2:pandas-dev/pandas",
    "src:gh-t2:psf/black",
    "src:gh-t2:psf/requests",
    "src:gh-t2:pyca/cryptography",
    "src:gh-t2:pydantic/pydantic",
    "src:gh-t2:pydantic/pydantic-core",
    "src:gh-t2:pypa/packaging",
    "src:gh-t2:pypa/pip",
    "src:gh-t2:pypa/setuptools",
    "src:gh-t2:pypa/virtualenv",
    "src:gh-t2:pypa/wheel",
    "src:gh-t2:pytest-dev/pluggy",
    "src:gh-t2:pytest-dev/pytest",
    "src:gh-t2:pytest-dev/pytest-cov",
    "src:gh-t2:python-attrs/attrs",
    "src:gh-t2:python-jsonschema/jsonschema",
    "src:gh-t2:python-pillow/Pillow",
    "src:gh-t2:python-poetry/poetry",
    "src:gh-t2:python-trio/trio",
    "src:gh-t2:python/mypy",
    "src:gh-t2:redis/redis-py",
    "src:gh-t2:samuelcolvin/dirty-equals",
    "src:gh-t2:scikit-learn/scikit-learn",
    "src:gh-t2:scrapy/scrapy",
    "src:gh-t2:sdispater/pendulum",
    "src:gh-t2:serde-rs/serde",
    "src:gh-t2:sindresorhus/got",
    "src:gh-t2:spf13/cobra",
    "src:gh-t2:sqlalchemy/sqlalchemy",
    "src:gh-t2:sympy/sympy",
    "src:gh-t2:theskumar/python-dotenv",
    "src:gh-t2:tiangolo/sqlmodel",
    "src:gh-t2:tornadoweb/tornado",
    "src:gh-t2:tox-dev/tox",
    "src:gh-t2:urllib3/urllib3",
    "src:gh-t2:wimglenn/johnnydep",
    "src:gh-t2:yaml/pyyaml"
  ],
  "record_counts": {
    "issue": 2282,
    "pull_request": 14716
  },
  "edge_counts": {
    "fixes": 2744
  },
  "relation_types": [
    "fixes"
  ],
  "split_policy": {
    "frozen": true,
    "method": "temporal-by-issue-created",
    "seed": 0,
    "boundary": "earliest 60% of fixes by issue date = train"
  },
  "redistribution": "metadata_only",
  "known_limitations": [
    "Closed issues + closed PRs from 80 permissive (MIT/BSD/Apache/ISC/PSF) repos across Python/JS/TS/Go/Rust; fixes edges mined from closing keywords (recall-limited).",
    "Body text truncated to 500 chars; metadata only, not full source. R14's paired control showed 500-char truncation outperforms full text for this task while keeping size bounded.",
    "Tier-2 scale; a one-time live snapshot, not reproducible from CI. Ids are minted in the gh-t2: namespace so they stay disjoint from the pilot/scale/full snapshots on the global validate-data scan.",
    "Re-confirms the bag-of-tokens baselines (vanilla / IDF / diagonal) at Tier-2 scale; the LoRA-at-Tier-2 run is a torch follow-up owned by central."
  ],
  "notes": "Built by data/tier2/build_tier2.py (live GitHub REST). Grows the 55-repo data/scale/ entry (ds:gh-scale2-v0) to a real ~150-repo Tier-2 entry. Hard negatives are same-repo PRs by title/body token overlap."
}
