{
  "card_type": "dataset",
  "id": "ds:datebox-fixture-v0",
  "name": "datebox fixture",
  "version": "v0",
  "created_at": "2024-02-01T00:00:00Z",
  "sources": [
    "src:datebox"
  ],
  "record_counts": {
    "ci_log": 1,
    "diff": 1,
    "file": 3,
    "issue": 3,
    "pull_request": 3,
    "symbol": 2,
    "test": 2
  },
  "edge_counts": {
    "caused_by": 1,
    "covers": 2,
    "fixes": 3,
    "modifies": 4
  },
  "relation_types": [
    "caused_by",
    "covers",
    "fixes",
    "modifies"
  ],
  "split_policy": {
    "frozen": true,
    "method": "synthetic-fixed",
    "seed": 0,
    "boundary": "2024-02-01T00:00:00Z"
  },
  "redistribution": "synthetic_original",
  "known_limitations": [
    "Tiny synthetic fixture for smoke-testing the harness; not evidence of model quality."
  ],
  "notes": "Built by python data/fixtures/build_fixtures.py. Manifest hash sha256:28f007cfe25e33595a12bb6cca98cd1db8a2624ab0cd9aecd899c001403ce31b."
}
