{
  "card_type": "dataset",
  "id": "ds:gh-full-v0",
  "name": "public GitHub issue->fixing-PR (full text)",
  "version": "v0",
  "created_at": "2026-06-22T01:20:41Z",
  "sources": [
    "src:gh-full:pytest-dev/pytest",
    "src:gh-full:fastapi/fastapi",
    "src:gh-full:pydantic/pydantic",
    "src:gh-full:psf/requests",
    "src:gh-full:pallets/flask",
    "src:gh-full:pallets/click",
    "src:gh-full:pallets/jinja",
    "src:gh-full:encode/httpx",
    "src:gh-full:encode/starlette",
    "src:gh-full:encode/uvicorn",
    "src:gh-full:psf/black",
    "src:gh-full:Textualize/rich",
    "src:gh-full:fastapi/typer",
    "src:gh-full:python-attrs/attrs",
    "src:gh-full:tox-dev/tox",
    "src:gh-full:python-poetry/poetry",
    "src:gh-full:astral-sh/ruff",
    "src:gh-full:pallets/werkzeug",
    "src:gh-full:python-pillow/Pillow",
    "src:gh-full:scrapy/scrapy"
  ],
  "record_counts": {
    "issue": 357,
    "pull_request": 1951
  },
  "edge_counts": {
    "fixes": 509
  },
  "relation_types": [
    "fixes"
  ],
  "split_policy": {
    "frozen": true,
    "method": "temporal-by-issue-created",
    "seed": 0,
    "boundary": "earliest 60% of fixes by issue date = train"
  },
  "redistribution": "full_text",
  "known_limitations": [
    "Closed issues + closed PRs from ~20 permissive Python-ecosystem repos; fixes edges mined from closing keywords (recall-limited).",
    "Body text kept up to 8000 chars (full_text), vs the pilot's 500-char truncation; long machine-pasted logs are still bounded by the cap.",
    "Pilot scale; a one-time live snapshot, not reproducible from CI."
  ],
  "notes": "Built by data/full/build_full.py (live GitHub REST). The de-truncated sibling of ds:gh-pilot-v0 (same 20 repos). Redistribution is full_text (public issue/PR prose, research use, GH-Archive precedent). Hard negatives are same-repo PRs by title/body token overlap. Ids use the gh-full: namespace so the full and pilot frozen versions coexist."
}
