{
  "card_type": "dataset",
  "id": "ds:gh-scale2-v0",
  "name": "public GitHub issue->fixing-PR Tier-2-entry scale dataset",
  "version": "v0",
  "created_at": "2026-06-21T23:51:22Z",
  "sources": [
    "src:gh:Delgan/loguru",
    "src:gh:HypothesisWorks/hypothesis",
    "src:gh:Textualize/rich",
    "src:gh:Textualize/textual",
    "src:gh:agronholm/anyio",
    "src:gh:aio-libs/aiohttp",
    "src:gh:arrow-py/arrow",
    "src:gh:astral-sh/ruff",
    "src:gh:certifi/python-certifi",
    "src:gh:dask/dask",
    "src:gh:encode/httpcore",
    "src:gh:encode/httpx",
    "src:gh:encode/starlette",
    "src:gh:encode/uvicorn",
    "src:gh:ewels/rich-click",
    "src:gh:fastapi/fastapi",
    "src:gh:fastapi/typer",
    "src:gh:jd/tenacity",
    "src:gh:lxml/lxml",
    "src:gh:matplotlib/matplotlib",
    "src:gh:more-itertools/more-itertools",
    "src:gh:mwaskom/seaborn",
    "src:gh:networkx/networkx",
    "src:gh:numpy/numpy",
    "src:gh:pallets/click",
    "src:gh:pallets/flask",
    "src:gh:pallets/jinja",
    "src:gh:pallets/werkzeug",
    "src:gh:pandas-dev/pandas",
    "src:gh:psf/black",
    "src:gh:psf/requests",
    "src:gh:pyca/cryptography",
    "src:gh:pydantic/pydantic",
    "src:gh:pydantic/pydantic-core",
    "src:gh:pypa/packaging",
    "src:gh:pypa/pip",
    "src:gh:pypa/setuptools",
    "src:gh:pypa/virtualenv",
    "src:gh:pypa/wheel",
    "src:gh:pytest-dev/pytest",
    "src:gh:python-attrs/attrs",
    "src:gh:python-pillow/Pillow",
    "src:gh:python-poetry/poetry",
    "src:gh:python-trio/trio",
    "src:gh:python/mypy",
    "src:gh:samuelcolvin/dirty-equals",
    "src:gh:scikit-learn/scikit-learn",
    "src:gh:scrapy/scrapy",
    "src:gh:sdispater/pendulum",
    "src:gh:sqlalchemy/sqlalchemy",
    "src:gh:sympy/sympy",
    "src:gh:theskumar/python-dotenv",
    "src:gh:tox-dev/tox",
    "src:gh:urllib3/urllib3",
    "src:gh:yaml/pyyaml"
  ],
  "record_counts": {
    "issue": 479,
    "pull_request": 3193
  },
  "edge_counts": {
    "fixes": 562
  },
  "relation_types": [
    "fixes"
  ],
  "split_policy": {
    "frozen": true,
    "method": "temporal-by-issue-created",
    "seed": 0,
    "boundary": "earliest 60% of fixes by issue date = train"
  },
  "redistribution": "metadata_only",
  "known_limitations": [
    "Closed issues + closed PRs from 55 permissive (MIT/BSD/Apache) repos — the wider Python ecosystem plus a few JS/Go/Rust; fixes edges mined from closing keywords (recall-limited).",
    "Body text truncated to 500 chars; metadata only, not full source.",
    "Tier-2-entry scale; a one-time live snapshot, not reproducible from CI. Ids that collide with the frozen pilot snapshot are dropped so the two datasets stay id-disjoint.",
    "Re-confirms the bag-of-tokens baselines (vanilla / IDF / diagonal) at scale; embeddings / LoRA at scale are a torch follow-up."
  ],
  "notes": "Built by data/scale/build_scale.py (live GitHub REST). Grows the 20-repo pilot (ds:gh-pilot-v0) to a ~55-repo Tier-2 entry. Hard negatives are same-repo PRs by title/body token overlap."
}
